{"authoritative_refs":["docs/plans/agentic-research-system/design/02-task-event-and-artifact-schema.md","docs/plans/agentic-research-system/design/06-evaluation-observability-and-audit.md"],"content_hashes":{"README.md":"85b614681013f9cf4ba73c3aa493451cf9db3b51285710c1b3afaa12bd34f885","expected/post-control.json":"310a009949da387385fb04baaeff14460024afc1342c911e8fc67c5842a99e27","expected/pre-control.json":"6ab22846dd026910fa4fea3a3dea6cdb97271f278d56912e28f4df8dff2f18cb","expected/trajectory.json":"0a99425522fec163236fb19c23daf69574a9f3fb1149f148fa2d24539af9e620","graders/required.json":"dd94bbe753d62dbe9c24b21abf2cd95cb6fc0c3d8007919474d582784f5bf2d2","input/stimulus.json":"68f6ca6ef4997e7a173fbb84b476e9089a45ec86a6fa5c93961cdd099eefda19"},"fixture_id":"F-005","fixture_revision":"r1","reconstruction_method":"historical_minimized_reconstruction","redaction_record":"synthetic identifiers only; no restricted data or transcripts","schema_id":"ars://evals/fixture-source-manifest","schema_version":"1.0.0","source_snapshot_date":"2026-07-01","variant_bindings":[{"os":"windows","provider_variant":"provider-neutral","runtime_variant":"python-3.13","transport":"in_process_fake","variant_id":"python313-windows-in-process"}]}
