{"authoritative_refs":["docs/plans/agentic-research-system/design/02-task-event-and-artifact-schema.md","docs/plans/agentic-research-system/design/06-evaluation-observability-and-audit.md"],"content_hashes":{"README.md":"114d067c4654361937550f508d6fd1e1f60f54056bfc945412a29006eb4d2473","expected/post-control.json":"eeef8eac67db6f24ab983400528968d935ad21f6951e7d246b55c893219d5624","expected/pre-control.json":"7189f7969fb72ee16d7739ec503d3feb6b38025eee5de170a224a5d14a60cc48","expected/trajectory.json":"4556c9f30daa282db4dca8a0bbb83fadcd603ff15ee04d2a43ed6c69bdb9527e","graders/required.json":"0ee9708c5efa2c98184744cb75a01a2177a4d42acd9e3e107c85e9b2b7a3a168","input/stimulus.json":"087d88b5b324b71a5d60be3310a53716e2003ded0955bd8f5d0c0dd5bec83b33"},"fixture_id":"S-011","fixture_revision":"r1","reconstruction_method":"specification_derived_synthetic_case","redaction_record":"synthetic identifiers only; no restricted data or transcripts","schema_id":"ars://evals/fixture-source-manifest","schema_version":"1.0.0","source_snapshot_date":"2026-07-01","variant_bindings":[{"os":"windows","provider_variant":"provider-neutral","runtime_variant":"python-3.13","transport":"in_process_fake","variant_id":"python313-windows-in-process"}]}
