{"authoritative_refs":["docs/plans/agentic-research-system/design/03-context-memory-and-retrieval.md","docs/plans/agentic-research-system/design/04-agent-roles-and-model-routing.md","docs/plans/agentic-research-system/design/05-research-assurance-and-independent-review.md","docs/plans/agentic-research-system/design/06-evaluation-observability-and-audit.md"],"content_hashes":{"README.md":"935196efe0923f4f3df6f690d00fef9ae0767676e0dc642d6aac87cf552698cc","expected/post-control.json":"404a30707e6b97baa7b1d79093963dabc86595486f7e9a480aee1a4d51a27bfa","expected/pre-control.json":"ef824a19e1233b670e160a092e98763338f5e6707310e616c3e2002489ea4e23","expected/trajectory.json":"2b5f95041d1b3fc909439b5fdb1e1fdee284cba4863acae5c4e1545ab7065d13","graders/required.json":"bf8bb51991279176a2847895e489f8366e2ffad264dd4cbf5a9f8fc332f92e85","input/stimulus.json":"8da6433b3f28996a9c90ef3e33f4b8a4561ff436685e4a5c49e1d947b6fdd0bb"},"fixture_id":"F-025","fixture_revision":"r1","reconstruction_method":"historical_minimized_reconstruction","redaction_record":"synthetic identifiers only; no restricted data or transcripts","schema_id":"ars://evals/fixture-source-manifest","schema_version":"1.0.0","source_snapshot_date":"2026-07-01","variant_bindings":[{"os":"windows","provider_variant":"provider-neutral","runtime_variant":"python-3.13","transport":"in_process_fake","variant_id":"python313-windows-in-process"}]}
